stt,en,vi,ipa
501,Vegetables are good for my health.,Rau củ rất tốt cho sức khỏe của tớ.,ˈvɛd͡ʒtəbəlz ɛə ɡʊ(d) for mi hɛlθ
502,I turn head over heels.,Tớ lộn ngược.,aɪ /tɜːn/ hɛd /ˈəʊ.və(ɹ)/ hiːlz
503,Everything looks upside down.,Mọi thứ trông như bị đảo ngược.,ˈɛvɹiθɪŋ lʊks ˈʌpˌsaɪd daʊn
504,I am good at doing somersaults.,Tớ rất giỏi lộn nhào.,aɪ e̞m ɡʊ(d) at ˈduːɪŋ somersaults
505,I get up my myself.,Tớ tự đứng dậy.,aɪ ɡɛt ap mi maɪˈsɛlf
506,I dust off my bottom.,Tớ phủi mông.,aɪ dʌst ɔːf mi ˈbɒtəm
507,Somersaults are a piece of cake.,Lộn nhào thật dễ.,somersaults ɛə æɪ piːs ɔv keɪk
508,I push up my friend’s bottom.,Tớ đẩy mông bạn tớ.,aɪ pʷʊʃ ap mi fɹɛnd s bottom
509,I help him to do a somersault.,Tớ giúp cậu ấy lộn nhào.,i help him to do a somersault
510,He practices it many time.,Cậu ấy luyện tập rất nhiều lần.,he practices it many time
511,I skip rope ten times without stopping.,Tớ nhảy dây 10 lần liên tục mà không nghỉ.,i skip rope ten times without stopping
512,I won’t stop until twenty.,Tớ sẽ không dừng lại cho đến lần thứ 20.,i won t stop until twenty
513,I’m out of breath.,Tớ sắp hết hơi rồi.,aɪ m æɔt ɔv bɹɛθ
514,I stand in line.,Tớ đứng trong hàng.,aɪ stænd ɪn laɪn
515,I wait for my turn.,Tớ đợi đến lượt mình.,aɪ weɪt for mi /tɜːn/
516,Whose turn is it?,Đến lượt ai rồi nhỉ?,huːz /tɜːn/ is ɪt
517,I run and jump.,Tớ chạy và nhảy.,aɪ /ɹʊn/ and dʒʌmp
518,I jump as far as I can.,Tớ nhảy xa nhất có thể.,aɪ dʒʌmp ˈæs fɑː ˈæs aɪ ˈkæn
519,My classmate runs after me.,Bạn cùng lớp của tớ đang chạy sau tớ.,mi ˈklɑːs.meɪt ɹʌnz ˈæf.tə(ɹ) /miː/
520,I wash my hands.,Tớ rửa tay.,aɪ wɑʃ mi hæn(d)z